{"audit":{"dataset_reads":0,"model_loads":1,"network_requests":0,"provider_requests":0},"claims":{"bf16_q4_bit_exact":false,"diagnostic_only":true,"formal":false,"full_generation_kv_shared":false,"multi_stream":false,"numeric_equivalence":false,"proxy_signal_passed":true,"quality_validated":false,"thresholds_formal":false,"training_authorized":false,"zero_copy":false},"config_file_sha256":"16022d9f834da8b32aa882fb1b5e771ba6a13d94d53b4dc4fadb19936f1472c8","config_sha256":"e007311d5ad3e729d60cfc20daebb8e331007f6fd9646bfdc53fef5d2d1d71d4","gates":{"adapter_effect":true,"all_passed":true,"argmax":true,"finite":true,"greedy":true,"memory":true,"missing_trigger":true,"paired_differential":true,"paired_relative":true,"prefix_kv":true,"shapes":true},"implementation_sha256":"3f737fe077388c36b78ffc9c54e91fbad2ac20d8f6548974df0be853a23a9d92","metrics":{"adapter_effect_max_abs":1.417264461517334,"all_finite":true,"alora_argmax_equal":true,"alora_full_split_max_abs":0.0,"base_argmax_equal":true,"base_full_split_max_abs":0.0,"greedy_tokens_equal":true,"missing_trigger_effect_max_abs":0.0,"paired_differential_max_abs":0.0,"paired_to_adapter_effect_ratio":0.0,"shapes_equal":true},"model_identity":{"config_json_sha256":"a102086c644174f9f7432df15d28fd69ad687b64d8e7756f0e9b6bfabc002d0c","export_manifest_sha256":"61a9ac5fab43da9bf053eb46642a030fcd7485100c3e82eb5d90f03b9d8124bb","exporter":"keras_hub.models.Gemma3CausalLM.export_to_transformers","id":"google/gemma-3-1b-it-keras-v3-hf-export","layers":26,"load_strategy":"authenticated_private_physical_copy","model_safetensors_sha256":"c9c6e309cf0158050d1e1abcba19eb6798153468572af2cd91de163e74933df9","parameters":999885952,"sentencepiece_sha256":"1299c11d7cf632ef3b4e11937501358ada021bbdf7c47638d13c0ee982f2e79c"},"routes":{"adapter_kind":"alora","adapter_saved":false,"alpha":8,"cache_layers":26,"executed":["base_full","base_split","alora_full","alora_split","missing_trigger_active","missing_trigger_off","prefix_active","prefix_off"],"full_cache_tokens":45,"planner_private_kv_reused":false,"planner_request_executed":false,"prefix_cache_tokens":25,"prefix_kv_bit_equal":true,"rank":4,"reuse_scope":"exact_plaintext_r2_pre_invocation_base_prefix_only","target_modules":["q_proj"],"training_steps":0},"runtime":{"attention_implementation":"eager","cublas_workspace_config":":4096:8","cuda":"12.1","dtype":"float32","gpu":"NVIDIA GeForce RTX 3080 Ti","matmul_precision":"high","peak_allocated_mib":3921.4814453125,"peak_reserved_mib":4014.0,"peft":"0.19.1","python":"3.11.15","sentencepiece":"0.2.1","tf32":true,"torch":"2.5.1+cu121","transformers":"5.13.0"},"schema_sha256":{"config":"e0755a253fd4203c186d50553a1439ef6b4f14ebe6a7383519bf4ff64b47fb59","receipt":"178ae228716d4d26c91185d03954dbcd1b36592a459756bb7b0b43488b101004"},"schema_version":"anchor.gemma3-alora-prefix-kv-diagnostic-receipt.v1","status":"passed","tokenization":{"bos_source":"sentencepiece_model_explicit_prepend","boundary":{"character_end":121,"character_start":101,"cover_end":121,"cover_start":100,"left_overhang_codepoints":1,"left_overhang_sha256":"36a9e7f1c95b82ffb99743e0c5c4ce95d83c9a430aac59f84ef3cbfab6145068","left_overhang_utf8_bytes":1,"right_overhang_codepoints":0,"right_overhang_sha256":"e3b0c44298fc1c149afbf4c8996fb92427ae41e4649b934ca495991b7852b855","right_overhang_utf8_bytes":0},"complete_request_tokenized_once":true,"full_tokens":45,"hf_export_config_bos_id":1,"hf_export_config_eos_id":2,"invocation_token_ids_sha256":"2e7a58d258ee4fcf9ed91450b2e5d3d9aeda5786c5cde36f767999d15cc399dd","invocation_tokens":6,"isolated_trigger_encoding_authoritative":false,"ordered_token_ids_sha256":"a54a6e03ceb6d48e670a3190aea4b233e1c7ea3edb954b17337285d87dcbae88","post_invocation_tokens":14,"prefix_token_ids_sha256":"96500d340c04e7f8ef8809073828f6f641d00f5a5af7a9a9ab0aefda3c06bbc9","prefix_tokens":25,"request2_utf8_sha256":"c5a7f123980701c577e26ba7d0cb2e40922c76e9f25c2f58f6ee4da866bff3ab","sentencepiece_bos_id":2,"sentencepiece_eos_id":1,"serialization_version":"anchor.gemma3-plaintext-r2.v1","token_ids_digest_algorithm":"sha256_signed_int64_big_endian_concatenation_v1","tokenizer_model_proto_authenticated":true,"trigger_span_end":31,"trigger_span_semantics":"zero_based_start_inclusive_end_exclusive","trigger_span_start":25,"trigger_text_occurrences":1,"trigger_text_sha256":"edbf9bbe304daa9847c6f0c4b543c56325a32c899e030b0bf870820c596b9884"}}
